{
  "schema": "stegverse.canonical-task-registration-request/v1",
  "request_id": "INTERLOCK-INTR-RUNTIME-INDEPENDENT-PROTOCOL-001.existing-identity.gen322.diagnostic",
  "task_id": "INTERLOCK-INTR-RUNTIME-INDEPENDENT-PROTOCOL-001",
  "registration_mode": "EXISTING_IDENTITY",
  "observed_registry_generation": 322,
  "allocation_request_ref": null,
  "authority_effect": "NONE_REGISTRATION_ONLY",
  "issue": "StegVerse-Labs/.github#3195",
  "collision_analysis": [
    "data/canonical-task-records/INTERLOCK-INTR-RUNTIME-INDEPENDENT-PROTOCOL-001.json exists (sha256 fde073d0371de3df002de47e77a84198493ec8bd93a20b75476ad7d444d725c5); no aggregate row at gen 320; control/task-vectors entry exists (cosv 50000000102000), no task-vector-index.d entry: existing-identity reconcile, not a new identity"
  ],
  "record": {
    "schema": "stegverse.canonical-task-record/v1",
    "task_id": "INTERLOCK-INTR-RUNTIME-INDEPENDENT-PROTOCOL-001",
    "correlation_id": "INTERLOCK-INTR-RUNTIME-INDEPENDENT-PROTOCOL-001",
    "root_correlation_id": "MASTER-RECORDS-REPORTABLE-CHECKPOINT-001",
    "parent_task_id": "MASTER-RECORDS-REPORTABLE-CHECKPOINT-001",
    "goal": "Define and validate a runtime-independent Interlock/InTr state-transition-dependent data-transfer protocol and machine-readable conformance contract.",
    "coordination_state": "ACTIVE",
    "cosv": {
      "profile": "task.v1",
      "vector": "50000000102000",
      "source_state_vector_ref": "control/task-vectors/INTERLOCK-INTR-RUNTIME-INDEPENDENT-PROTOCOL-001.json",
      "authority_effect": "NONE"
    },
    "source_refs": [
      "docs/INTERLOCK_INTR_RUNTIME_INDEPENDENT_PROTOCOL_MIRROR_HANDOFF.md",
      "schemas/interlock-intr-runtime-independent-protocol-v1.schema.json"
    ],
    "targets": {
      "organizations": [
        "StegVerse-Labs"
      ],
      "repositories": [
        "StegVerse-Labs/.github"
      ],
      "components": [
        "interlock",
        "intr",
        "manifest",
        "state-transition-disposition",
        "transfer-receipt",
        "interoperability"
      ]
    },
    "dependencies": [
      "MASTER-RECORDS-REPORTABLE-CHECKPOINT-001"
    ],
    "blockers": [],
    "expected_evidence_predicates": [
      "REGISTERED_NODE_IDENTITY_BOUND",
      "MANIFEST_INTENT_BOUND",
      "SOURCE_DESTINATION_BOUND",
      "PAYLOAD_COMMITMENT_BOUND",
      "APPLICABLE_STATE_OR_PREDECESSOR_BOUND",
      "REQUESTED_CAPABILITY_BOUND",
      "ALLOW_DENY_FAIL_CLOSED_DISPOSITION_REQUIRED",
      "TRANSFER_RECEIPT_BOUND",
      "RESULTING_STATE_COMMITMENT_BOUND_WHEN_APPLICABLE",
      "EVIDENCE_REFERENCES_BOUND",
      "PARTICIPATING_RUNTIME_IMPLEMENTATION_NOT_REQUIRED",
      "NO_EXTERNAL_ADOPTION_OR_CONFORMANCE_CLAIM_WITHOUT_EVIDENCE"
    ],
    "runtime_requirements": {
      "capabilities": [
        "specification",
        "deterministic_conformance_vectors"
      ],
      "environment": "DOCUMENTARY_NON_AUTHORIZING",
      "direction": "REGISTERED_NODE_TO_REGISTERED_NODE",
      "mutation_required": false,
      "deployment_required": false,
      "current_observation_required": false
    },
    "worker_claim": {
      "authority": "WORKERCOORDINATOR",
      "claim_ref": null,
      "fence_ref": null,
      "projection_only": true
    },
    "completion": {
      "claimed": false,
      "validated": false,
      "reconciliation_ref": "docs/INTERLOCK_INTR_RUNTIME_INDEPENDENT_PROTOCOL_MIRROR_HANDOFF.md"
    },
    "allowed_next_transitions": [
      "PROTOCOL_SCHEMA_AND_CONFORMANCE_VECTORS_VALIDATED"
    ],
    "authority_model": {
      "transport_protocol": "INTERLOCK_INTR",
      "participating_runtime_authority": "LOCAL_TO_EACH_FRAMEWORK",
      "stegverse_output_governance": "STEGVERSE",
      "external_framework_governance": "NOT_ASSUMED",
      "task_registry_mints_execution_authority": false
    },
    "execution_substrate_resolution": {
      "schema": "stegverse.execution-substrate-resolution/v1",
      "review_order": [
        "STEG-BROWSER-RETAINED-RESIDENT-NODE",
        "STEGOS-CURRENT-DEVICE-NODE",
        "STEG-BROWSER-EPHEMERAL-LEASE",
        "SAME-DEVICE-SITE-SAFARI-SERVICE-WORKER",
        "ADMITTED-EPHEMERAL-STEGOS-NODE",
        "REMOTE-OR-EXTERNAL-DEVICE-LAST-RESORT"
      ],
      "reviews": [
        {
          "substrate_id": "STEG-BROWSER-RETAINED-RESIDENT-NODE",
          "disposition": "NOT_APPLICABLE",
          "limitation_class": "NOT_APPLICABLE",
          "evidence_refs": []
        },
        {
          "substrate_id": "STEGOS-CURRENT-DEVICE-NODE",
          "disposition": "NOT_APPLICABLE",
          "limitation_class": "NOT_APPLICABLE",
          "evidence_refs": []
        },
        {
          "substrate_id": "STEG-BROWSER-EPHEMERAL-LEASE",
          "disposition": "NOT_APPLICABLE",
          "limitation_class": "NOT_APPLICABLE",
          "evidence_refs": []
        },
        {
          "substrate_id": "SAME-DEVICE-SITE-SAFARI-SERVICE-WORKER",
          "disposition": "NOT_APPLICABLE",
          "limitation_class": "NOT_APPLICABLE",
          "evidence_refs": []
        },
        {
          "substrate_id": "ADMITTED-EPHEMERAL-STEGOS-NODE",
          "disposition": "NOT_APPLICABLE",
          "limitation_class": "NOT_APPLICABLE",
          "evidence_refs": []
        },
        {
          "substrate_id": "REMOTE-OR-EXTERNAL-DEVICE-LAST-RESORT",
          "disposition": "NOT_APPLICABLE",
          "limitation_class": "NOT_APPLICABLE",
          "evidence_refs": []
        }
      ],
      "selected_substrate_id": null,
      "external_device_required": false,
      "second_user_operated_device_allowed": false,
      "authority_effect": "NONE"
    }
  },
  "vector": {
    "evidence_refs": [
      "StegVerse-Labs/.github@86382e60:data/canonical-task-records/INTERLOCK-INTR-RUNTIME-INDEPENDENT-PROTOCOL-001.json",
      "StegVerse-Labs/.github@86382e60:control/task-vectors/INTERLOCK-INTR-RUNTIME-INDEPENDENT-PROTOCOL-001.json"
    ],
    "exact_metrics": {
      "_": "UNKNOWN_NOT_AUTHENTICALLY_OBSERVED"
    },
    "observed_at": "UNKNOWN_NOT_AUTHENTICALLY_OBSERVED",
    "metric_evidence": {
      "_": "UNKNOWN_NOT_AUTHENTICALLY_OBSERVED: control/task-vectors carries cosv 50000000102000 (stegverse.task-vector/v1) without exact_metrics; the shard carries cosv, not cosv_task_vector; no task-vector-index.d entry"
    }
  }
}
